00:00.0 Host bridge: Advanced Micro Devices, Inc. [AMD] Example Root Root Complex (rev 02)
	Subsystem: Advanced Micro Devices, Inc. [AMD] Example Root Root Complex
	Control: I/O- Mem- BusMaster- SpecCycle- MemWINV- VGASnoop- ParErr- Stepping- SERR- FastB2B- DisINTx-
	Status: Cap- 66MHz- UDF- FastB2B- ParErr- DEVSEL=fast >TAbort- <TAbort- <MAbort- >SERR- <PERR- INTx-

00:01.1 PCI bridge: Advanced Micro Devices, Inc. [AMD] Example Root PCIe USB4 Bridge (rev 02) (prog-if 00 [Normal decode])
	Subsystem: Advanced Micro Devices, Inc. [AMD] Example Root PCIe USB4 Bridge
	Control: I/O+ Mem+ BusMaster+ SpecCycle- MemWINV- VGASnoop- ParErr- Stepping- SERR- FastB2B- DisINTx+
	Status: Cap+ 66MHz- UDF- FastB2B- ParErr- DEVSEL=fast >TAbort- <TAbort- <MAbort- >SERR- <PERR- INTx-
	Latency: 0, Cache Line Size: 64 bytes
	Interrupt: pin ? routed to IRQ 32
	IOMMU group: 2
	Bus: primary=00, secondary=01, subordinate=60, sec-latency=0
	I/O behind bridge: a000-dfff [size=16K] [16-bit]
	Memory behind bridge: bc000000-d3ffffff [size=384M] [32-bit]
	Prefetchable memory behind bridge: 7000000000-8fffffffff [size=128G] [32-bit]
	Secondary status: 66MHz- FastB2B- ParErr- DEVSEL=fast >TAbort- <TAbort- <MAbort- <SERR- <PERR-
	BridgeCtl: Parity- SERR+ NoISA- VGA- VGA16+ MAbort- >Reset- FastB2B-
		PriDiscTmr- SecDiscTmr- DiscTmrStat- DiscTmrSERREn-
	Capabilities: <access denied>
	Kernel driver in use: pcieport
	Kernel modules: shpchp
